{
  "id": "dark-showcase-panel",
  "displayName": "Dark Showcase Panel",
  "description": "A dark neutral backdrop that helps colorful fish stand out.",
  "sourceType": "built-in",
  "themeTags": ["showcase", "minimal", "modern", "betta-display"],
  "availability": {
    "modes": ["sandbox", "career"],
    "guestSandboxAvailable": true,
    "requiresAccount": false,
    "allowPublicUse": true,
    "premiumOnly": false
  },
  "rendering": {
    "imagePath": "assets/backdrops/dark-showcase-panel.png",
    "focalPoint": "center",
    "recommendedTankThemes": ["showcase", "betta-display", "minimal"],
    "supportsColorTint": false
  }
}
